sequence, count
one i do n't know, 1
my plan to help you, 1
do n't you let us, 1
which we do n't even, 1
nasties said about being police, 1
because they 'll make baked, 1
with my unicorn magic and, 1
forget-me-not and i are the, 1
had a feeling you might, 1
still flows in her veins, 1
who cares what the sun, 1
's fill up the hole, 1
to get any bigger cupcake, 1
to my father the king, 1
ma'am they ruin the soil, 1
dumb guards stop us from, 1
the babies ' shadows were, 1
's one reason why ice, 1
was pushed into the land, 1
does n't mean it 's, 1
and there is n't any, 1
one flick of my magic, 1
what red ball would be, 1
to have loved ones who, 1
what happened to the flutter, 1
gock and gluda have sent, 1
nothing 's gon na be, 1
megan we 're never gon, 1
n't you unicorns just disappear, 1
that means you did n't, 1
was separated from my parents, 1
the tide has turned boss, 1
make that stuff in the, 1
pony who tried to dump, 1
flashstone will do whatever he, 1
it move it move it, 1
to show you first-tooth ponies, 1
she 's put down some, 1
and--oh i just wished for, 1
as the ruler 's best, 1
and i ca n't wink, 1
believe me there are no, 1
speaking of friends where is, 1
always catch princesses and hold, 1
use it any time i, 1
potion which i knocked us, 1
why have you come here, 1
for my prize roses but, 1
looks like the place the, 1
'll speak to my old, 1
will try it before it, 1
you when you stand with, 1
this was n't such a, 1
i suppose i could sing, 1
i 'm just not cut, 1
and he has been for, 1
's found the flashstone yet, 1
'm taking him with me, 1
let 's make a new, 1
oh how i 've longed, 1
that the best you can, 1
costume ball tonight you need, 1
're lousing up my aim, 1
direct descendent of that unicorn, 1
suppose it 's the way, 1
'll fight it as long, 1
me something pointer do you, 1
like it affects just the, 1
the rainbow is not such, 1
know these gullies like the, 1
what you would do for, 1
she 'd kick me out, 1
power of light so that, 1
coulda' known that football is, 1
we never did decide who, 1
be sure they get good, 1
lava rock from the roiling, 1
habbit and i will look, 1
all into glass and then, 1
being crowded out of the, 1
only you could break your, 1
on it 's almost midnight, 1
shoop-shoop-bee-doo wan na play with, 1
north star i hope you, 1
dear me i know it, 1
it normally comes from north, 1
long before you ponies lived, 1
find that mean old ghost, 1
teach him a lesson he, 1
you can make hydia proud, 1
seems to be the source, 1
just use them against each, 1
do n't mess with me, 1
oh sonny where can i, 1
the coin glowed and dematerialized, 1
'm not only useless but, 1
n't do this to me, 1
do n't get stuck either, 1
to begin a long journey, 1
uh i think bumbleland 's, 1
bad luck down on yourself, 1
ca n't say i blame, 1
to get the bull back, 1
well if gluda and gock, 1
leave before you start hating, 1
do we do with the, 1
both of you is thinkin', 1
ponies are not our friends, 1
useless but i 'm a, 1
the symbol engraved on each, 1
it 's because of the, 1
were placed on the hooves, 1
frazzits remain in the barrel, 1
i just wished for a, 1
ponies and i will lead, 1
a lot of us ca, 1
on we can catch that, 1
for youe and it 'll, 1
i should have stayed to, 1
recourse is to make a, 1
i are going in the, 1
do n't go away mad, 1
's house is not far, 1
and lava demons can never, 1
like we could help her, 1
a new kingdom for us, 1
'll call you dinah then, 1
why not stay with bushwoolies, 1
to but it would take, 1
shoop-shoop-bee-doo hi have you seen, 1
because of you the little, 1
i wonder how mimic is, 1
already done the only thing, 1
thinks he 's figured out, 1
creating a cold ferocious beast, 1
pony shadow was n't enough, 1
moochick and the baby ponies, 1
's easy i 'll be, 1
sorry for you and tried, 1
and there was this coin, 1
work is truly magnificent oh, 1
c-c-cold where i live edgar, 1
it we ask it to, 1
will be coming over at, 1
think we ought a help, 1
truly all of ponyland is, 1
eaten anything in three days, 1
maybe i could have helped, 1
this floating castle faster if, 1
foretold that fleetfoot would win, 1
'll have the neatest gadget, 1
from flutter valley and grow, 1
i do n't know gusty, 1
our home 's okay now, 1
ruins of the city of, 1
but master there is n't, 1
the unicorns wink in and, 1
's wed attracts misadventure the, 1
to look in the book, 1
oh i forgot to tell, 1
ponies so there are probably, 1
would 've become a disaster, 1
put them out of it, 1
the dark for all eternity, 1
ruler grogar tried to conquer, 1
makes me feel a lot, 1
the frazzits into the barrel, 1
if we do n't know, 1
happened to the flutter ponies, 1
belongs to niblick only he, 1
are we 'll figure out, 1
longer until flutter valley rots, 1
we may need some help, 1
true your small black cloud, 1
escape and get some help, 1
much trouble my father made, 1
and i 'm not hiding, 1
are you interrupting me when, 1
furbobs never agree on anything, 1
's get the other ponies, 1
hair must be absolutely squeaky, 1
maybe we can blow down, 1
but i 'm sure they, 1
even big brothers like they, 1
yeah that 's it wind, 1
that 's fine with me, 1
the wind left her at, 1
'sposed to make people happy, 1
is not t-t-tasty good food, 1
paradise estate would 've become, 1
n't make it to paradise, 1
now it 's all ours, 1
his feelings from the heartstone, 1
ta be water some place, 1
of course not master right, 1
dinner is at 8 sharp, 1
get stronger as you grow, 1
some nails and a new, 1
wan na play with us, 1
n't you worry about a, 1
megan she 'll help mimic, 1
him his power you know, 1
saved our dell and the, 1
and i are the only, 1
wind so cold that soon, 1
you move the soup from, 1
a seed it 's hard, 1
've longed to find one, 1
the ghost still here i, 1
you 're trying to say, 1
the princess ponies and their, 1
i should be in charge, 1
if it a ghost it, 1
gone on a trip or, 1
ca n't help but feel, 1
order a hole to be, 1
saving this for a special, 1
she was separated from them, 1
well there 's still time, 1
well that 's a definite, 1
of the wizard 's spell, 1
i got two and they, 1
i do n't think we, 1
boy if it is n't, 1
ta do better than that, 1
well they all left the, 1
herself and only gives back, 1
of you the little ponies, 1
c'm on hurry hurry hurry, 1
without new magic i wo, 1
was saving it for my, 1
want the horseshoe to save, 1
i did n't see a, 1
the party faster than you, 1
to help my friend thaw, 1
i-i do n't think that, 1
what they 're so afraid, 1
we do n't get it, 1
two 's been asking for, 1
is let him out and, 1
'll go with you back, 1
minute megan i 'm coming, 1
them and upset the balance, 1
soon my little cutie everywhere, 1
depths of the volcano of, 1
let 's go to bumbleland, 1
last one is near but, 1
they know we were coming, 1
as the flutter pony who, 1
be behind such a lovely, 1
n't such a good flier, 1
for evil too easily fizzy, 1
who was lost in the, 1
the thermal updrafts from the, 1
but morning glory is wrong, 1
the witches have taken over, 1
being an outward sign of, 1
let me shake both your, 1
we could go fly a, 1
let 's get a look, 1
you want us to stick, 1
now be off with ya, 1
know how ya all feel, 1
bad attitude brought your misfortune, 1
the little ponies in ponyland, 1
it last appeared 500 years, 1
a pegasus i do n't, 1
since the treasure belongs to, 1
have a surprise for you, 1
it 's a beautiful day, 1
the giant took giant steps, 1
good it really feels to, 1
do n't forget porcina 's, 1
there are those who still, 1
some of which we do, 1
gon na do to draggle, 1
yeah yeah it 's all, 1
start by stopping those little, 1
that you touch shall be, 1
monster anymore than prince charming, 1
what we do with them, 1
not such a bad guy, 1
now what are we gon, 1
wind whistler we 'll be, 1
lovely climate will be frozen, 1
sail for safe dry dock, 1
you 'll get the hang, 1
i must have that hair, 1
what are you throwin' at, 1
once upon a time there, 1
the dumbest thing i ever, 1
as will you edgar when, 1
i 'm obliged to grant, 1
rails at the finish line, 1
but what are you going, 1
said not to pass through, 1
ice cream again right away, 1
your shadow is just right, 1
do--then again i could be, 1
he just lose a privilege, 1
if you all went back, 1
's all right now baby, 1
do n't think they 're, 1
and forget-me-not were the only, 1
to go find some dragons, 1
all anyone 's wanted to, 1
was a wizard and promised, 1
anything to fear from megan, 1
may need some help getting, 1
do whatever he or she, 1
you 'll grow up to, 1
everybody 's safe and sound, 1
useless and they 're probably, 1
been for about ten thou, 1
how do we get in, 1
fighting so long i guess, 1
then it 's goodbye sun, 1
give them the rainbow of, 1
n't expect to see you, 1
bumble and her bees to, 1
you just need a little, 1
of sunlight and the sunstone, 1
do you have any idea, 1
about what happened to that, 1
we 've been waiting for, 1
you stand with the very, 1
joist and timber of this, 1
wan na thaw things out, 1
gon na destroy each other, 1
i have to think of, 1
forever unless megan and the, 1
'll fold up like an, 1
goons dancing around in funny, 1
me to have had anyway, 1
power of these coins can, 1
's because they smell bad, 1
land squirk and we 'll, 1
galaxy heart throb and i, 1
this material that the boys, 1
we do n't know for, 1
need more shadows or i, 1
been walking and walking and, 1
've tried everything and i, 1
whistler fly faster than you, 1
learned one thing tonight being, 1
anyone 's fun but--well you, 1
i 'll get the next, 1
get some grub i 'm, 1
jumping up and down on, 1
're free there 's still, 1
it through a simple jumping, 1
'm so proud of them, 1
blossom carry the bucket up, 1
find them and and turn, 1
it 's just a silly, 1
of my magic wand i, 1
go to bumbleland and free, 1
it hit it water lily, 1
may be ponyland 's only, 1
there 's quite a few, 1
in ponyland i 'd like, 1
our beautiful trees are barren, 1
till flutter valley turns rotten, 1
it 's hard to believe, 1
are the only two flutter, 1
yeah let 's help him, 1
can jump farther than any, 1
it is n't too late, 1
worry plenty of time to, 1
the sofa i was s'posed, 1
is he quitting but we, 1
oh my gosh what is, 1
going anywhere near somnambula again, 1
the most beautiful place in, 1
something about the witches in, 1
and scorpan if by midnight, 1
but what are we gon, 1
four-feet invade kingdom of charlatan, 1
rain and i might what, 1
leave his one true love, 1
all started when everything in, 1
explain while we go back, 1
been listening to too many, 1
up out of the dirt, 1
found in the hidden room, 1
that may will serve you, 1
sure this is gon na, 1
the sun is the lamp, 1
there 's still honey on, 1
any to say i 'm, 1
there was a strange girl, 1
place filled with lots of, 1
the best i can do, 1
north star are you all, 1
we 'll figure out how, 1
ride all over your rails, 1
i have to try and, 1
ponies are safe with the, 1
and here 's a chocolate, 1
for my sake but for, 1
we cleaned out the forest, 1
after us and used up, 1
me out of the volcano, 1
to be a way around, 1
how you like it when, 1
so when they come we, 1
we 've been running for, 1
really good at dark places, 1
's true you are not, 1
they marched back to their, 1
well um actually well she, 1
a minute these are my, 1
law are trapped where they, 1
us if we do n't, 1
you ever heard the one, 1
quite aware of just how, 1
squirk you 'll never rule, 1
what if i slip off, 1
everything and i ca n't, 1
your own worst enemy yourself, 1
ze key is on ze, 1
better find those coins and, 1
i guess we 'd better, 1
go back into the barrel, 1
's throne room is right, 1
fillies when we get home, 1
this is where megan lives, 1
his village and demolished it, 1
pony olympics are gon na, 1
value to the one we, 1
collapse the moon 's made, 1
but we 're back to, 1
if a ghost gets wet, 1
hate the flutter ponies too, 1
that 's where we 'll, 1
like a lovely costume party, 1
just passed the top-up-turtle test, 1
and the magic did n't, 1
the fireworks came from that, 1
wind whistler quick follow her, 1
've been searching my whole, 1
the boys are modeling for, 1
might tell us things if, 1
had the power of blazing, 1
the wands he might upset, 1
was lost in the jewel, 1
can you do it again, 1
galaxy and i ca n't, 1
do n't you talk to, 1
some weakness if only we, 1
she 's stopping the flood, 1
n't you think that 's, 1
if only one of us, 1
have to move the sunstone, 1
nasties know how to handle, 1
the hair of these here, 1
do n't want to take, 1
put a stop to this, 1
on the bubble 's surface, 1
too with edgar 's help, 1
wasted a perfectly good ice, 1
purple mountains you ca n't, 1
have a little fun have, 1
and-crunch the rockdog turned bushwoolies-turned, 1
you a saddle with seat, 1
well the magic has been, 1
too bad about that poor, 1
side of the big lake, 1
more fun if you were, 1
to save your friend correct, 1
no matter where i am, 1
caramel ice cream and all, 1
one and only steam-powered multi-tasking, 1
's all the water i, 1
we can tunnel under ahhg, 1
of light is the only, 1
we ask the flutter ponies, 1
you give it to us, 1
do n't tell anyone where, 1
listen to what the other, 1
the waterfall and pick flowers, 1
they 'd act like this, 1
he wanted in return was, 1
'm simply saying there may, 1
the sun will shine on, 1
i think now we 're, 1
you ca n't and do, 1
for anyone but us penguins, 1
baby ribbon get up okay, 1
yeah a privilege a privilege, 1
to save the rest of, 1
right if you like to, 1
now all anyone 's wanted, 1
it and i 'll find, 1
slither really fast scorpan really, 1
as light as a feather, 1
can do me a good, 1
rebuild this place we 'll, 1
does all this have to, 1
n't let anything bad happen, 1
and gluda have sent me, 1
i want the sunstone and, 1
hurry we can still get, 1
back and everybody can take, 1
our claws of this whole, 1
his magic will protect them, 1
you all those things but, 1
that 's easy for you, 1
baby ribbon where are you, 1
're quite welcome i am, 1
we 're movin' on right, 1
let 's push it out, 1
well magic ca n't fix, 1
friends may have to leave, 1
i did use your polish, 1
na share our new home, 1
or rather your friend knight, 1
rrowff rrowff rrowff rrowff ah, 1
unicorn magic and put it, 1
her at dawn and there, 1
see this situation for myself, 1
wands for my own use, 1
any idea what a dungeon, 1
ought a hold this little, 1
away into the darkening sunset, 1
and i was n't trying, 1
but but what about heart, 1
goblins do n't give things, 1
can as a free sample, 1
shoo-bee-doo shoop-shoop-bee-doo shoo-bee-doo shoop-shoop-bee-doo i, 1
to receive some company eh, 1
proud of each and every, 1
can have gingerbread cookies and, 1
the mirror this morning darling, 1
're the army that can, 1
the ponies and i will, 1
it looks like megan and, 1
will if ya know what, 1
flutter ponies to help us, 1
way to get the flashstone, 1
help we could do it, 1
has happened to our babies, 1
beam of lava 's power, 1
i pull you under with, 1
i am not bad luck, 1
a wonderful red ball that, 1
to do something soon or, 1
and the other half into, 1
come on let 's put, 1
oh he must have known, 1
gem but i neglected to, 1
i-i think you 're all, 1
my name is zeb what, 1
're not part of the, 1
was built to be deceiving, 1
let 's all settle down, 1
n't make fun of you, 1
is right you 'll find, 1
just close your eyes and, 1
figure out how to rescue, 1
merely refrain from expressing them, 1
mean i could help rescue, 1
up your minds quickly we, 1
locked the good guys in, 1
bet you do n't have, 1
for what i 've done, 1
the lava may make it, 1
our hair to re-weave it, 1
from a child unless the, 1
erebus had zeb steal everyone, 1
want to go home alone, 1
these crabies once and for, 1
you or me not about, 1
now let 's get some, 1
's only one thing powerful, 1
do you think we can, 1
not to pass through it, 1
wish it were as easy, 1
but tell the others to, 1
or paul bunyan can keep, 1
is proceeding at an alarming, 1
and your pa most would, 1
say one thing your squirkiness, 1
think i just made a, 1
'll be there as soon, 1
them into glass before they, 1
put an egg in your, 1
now we 're all aware, 1
an outward sign of some, 1
we ca n't let them, 1
not even when we have, 1
megan i do n't wan, 1
'll probably find the source, 1
we need your help to, 1
all right strange as in, 1
long before the water reaches, 1
waiting for my grandfather to, 1
i 've done it habbit, 1
will show you the way, 1
the babies ' shadows back, 1
you doing in there gusty, 1
in the book of lost, 1
dose of what i gave, 1
and the entire confection should, 1
that complaining you were doing, 1
ca n't the three of, 1
hurry so we can get, 1
for a musician called knight, 1
would make my merry men, 1
'll have a better place, 1
into glass and then i, 1
babies ' back their shadows, 1
power which he uses to, 1
rider and water lily have, 1
still do n't get it, 1
grogar and you 'll be, 1
the rainbow will you be, 1
what would she look like, 1
too showy for my taste, 1
i 'll get it down, 1
that can restore the magical, 1
this must be fun full, 1
but what 's ice cream, 1
he puts them in his, 1
used the power of his, 1
not hiding it under my, 1
he does n't see pluma, 1
she 's lost her twinkle, 1
i meant that we need, 1
before that shell gives out, 1
please take me with you, 1
few moments we 'll see, 1
is there any hope for, 1
i 'm out of power, 1
so i 'm gon na, 1
used the energy from the, 1
can have your old job, 1
flight and do aerial photography, 1
with the most items wins, 1
any heart into crunch himself, 1
pour it in a crack, 1
to be your own special, 1
that walking bad luck charm, 1
in your sandal and beat, 1
very sick your magic horseshoe, 1
so good as you robin, 1
the kaleidostone while tattle and, 1
hey what 's going on, 1
give it all you have, 1
it 's also too bad, 1
'd be-be-be-be back on our, 1
i 'm gon na ride, 1
'm really sorry baby moondancer, 1
i owe you an apology, 1
go make sure the babies, 1
here come heart throb and, 1
's get back to ponyland, 1
master honest i mean honestly, 1
my homeland was a beautiful, 1
i wish you remember us, 1
worth the loss of my, 1
friends were in no position, 1
the sand soft garth like, 1
the flutter ponies i proclaim, 1
they said use it any, 1
can you help me rescue, 1
we wo n't hear another, 1
look at this terrific experiment, 1
the game for the rest, 1
you miss him too do, 1
the sunstone to reflect the, 1
ca n't even make it, 1
got to go where he, 1
out of here huh can, 1
should be covered with 2, 1
it takes more than just, 1
's the best i can, 1
we promised we 'd fix, 1
melts enough we 'll be, 1
it between these jaws to, 1
to you and your friends, 1
spike that was not funny, 1
look i just do what, 1
is going to set soon, 1
we have to try to, 1
do n't know what we, 1
is needed to cure her, 1
troggles were conquered by grogar, 1
oh he was just plain, 1
long time anyway which is, 1
how long are we going, 1
if there 's no water, 1
is no time to waste, 1
we must form a search, 1
what i need is experience, 1
why is there a wall, 1
've got ta be clever, 1
but i 've never tried, 1
sick your magic horseshoe is, 1
my own powers are strong, 1
through that door and they, 1
and i will go with, 1
know if i can make, 1
where did you think you, 1
magic did n't backfire on, 1
and our children 's shadows, 1
what we 're looking for, 1
they have your brother and, 1
you shall guard these crowns, 1
n't stay for long for, 1
their magic powers are being, 1
the old bell even with, 1
sunstone will fade forever it, 1
we 'll ever be able, 1
must be the thing we, 1
why it 's so c-c-cold, 1
let the stonebacks get me, 1
me up and brand me, 1
little visit is in order, 1
too old to lift a, 1
guess everything will be back, 1
to congratulate my friend woebegone, 1
no more beautiful nectar-filled flowers, 1
fly overhead and guide the, 1
the moochick has magic powers, 1
will reach ponyland very soon, 1
shadows i need i will, 1
but i need four ponies, 1
but why should only penguins, 1
he made me do it, 1
at this rate it will, 1
they always catch princesses and, 1
can go as a princess, 1
grogar swore he would return, 1
megan what do you think, 1
hey how long are we, 1
whistler you could n't know, 1
the dell dwellers the forest, 1
can fly faster and higher, 1
squirk 's going to be, 1
was a big ol' mutt, 1
may we ask mave for, 1
volcano of gloom for good, 1
in a position to make, 1
am not used to it, 1
just an antique heart throb, 1
hope the moochick is figuring, 1
shell gives out maybe we, 1
we have one chance flutter, 1
mixville ice cream works to, 1
to be a grown up, 1
come from the treasure collection, 1
you come with me to, 1
still get over the rainbow, 1
eighty years or so when, 1
my bad luck was working, 1
ponies and you 're going, 1
if ya know what 's, 1
what 's happened to my, 1
must be the real one, 1
'm going to the costume, 1
only the greatest treasure of, 1
me pictures of goons dancing, 1
that all this belongs to, 1
want to live where it, 1
practice if you 're going, 1
does n't sound so difficult, 1
much hair the bushwoolies shed, 1
now it 's my turn, 1
duchess can have your old, 1
oh i hope we do, 1
know how to thank ya, 1
have run for help or, 1
back in ponyland will be, 1
shape and get us out, 1
that one pony shadow was, 1
mass and being converted into, 1
i do n't get it, 1
happy to guide you back, 1
other half into what came, 1
soon it will be ours, 1
to find water for the, 1
they do n't think they, 1
say get rid of her, 1
yourself all day or do, 1
noticed how could it 's, 1
why are you interrupting me, 1
i am knight shade 's, 1
is a nice big ice-cream, 1
believe me when i say, 1
see if we can find, 1
you do do n't spill, 1
paradise estate and rest up, 1
the sunstone back here soon, 1
it 's like all their, 1
i 'm afraid it 's, 1
five-to-one you 'd come back, 1
realm of darkness a sort, 1
'm afraid i 'll fall, 1
grogar did n't capture all, 1
not have a fourth pony, 1
you could break your own, 1
he 's got just what, 1
woolie pies for you rosedust, 1
to get hurt no matter, 1
n't be too much trouble, 1
to what the other ponies, 1
with their help we can, 1
the magic horseshoe you wear, 1
locket with the rainbow of, 1
jubilee you can do it, 1
could use someone who likes, 1
thought you locked suzette in, 1
search party and follow their, 1
no you ca n't do, 1
sunstone to reflect the sun, 1
we 're gon na be, 1
the work of replacing my, 1
i 'll save you your, 1
got to help us find, 1
we 're police and they, 1
and the rest of them, 1
the crack something we could, 1
castle can pull away from, 1
have more fun if you, 1
as long as we can, 1
the duchess ascended to ze, 1
into his castle and swipe, 1
you can try it if, 1
we 're tired of being, 1
tape we can use it, 1
the prince philippe de branforr, 1
valley and tell the girl, 1
did you think you were, 1
we find it we ask, 1
it does n't look friendly, 1
to use my fire breath, 1
is megan she has a, 1
you through these maze agreed, 1
i created crunch the rockdog, 1
can get out when they, 1
hey you ca n't do, 1
whistler lofty lickety-split danny and, 1
a wonderful day for a, 1
cross that bridge when we, 1
's nothing you can do, 1
why should i crawl to, 1
i ca n't believe you, 1
afraid gusty 's gone too, 1
only we had more help, 1
's about the giant that, 1
flying pony of all time, 1
oh i ca n't move, 1
for the w-winter and it, 1
everything will be just ducky, 1
that was how i could, 1
fudgy please this is not, 1
why did the boy threw, 1
to do something about those, 1
we just have to keep, 1
spell 's over now that, 1
i am especially interested in, 1
it looked like something was, 1
what gives him his power, 1
world we have to be, 1
taken years to put together, 1
kingdom of the lava demons, 1
's the witches again and, 1
to the party faster than, 1
must say it looks much, 1
that you 've got to, 1
proceeding at an alarming pace, 1
herself to a tropical vacation, 1
drain the magic in the, 1
the source of erebus ', 1
and it gets louder the, 1
shade wonderfulest bravest hero ever, 1
would you expect from somebody, 1
jaunt to the right and, 1
in bumbleland to keep flutter, 1
just got to set your, 1
can not part with it, 1
do hope they can rescue, 1
still honey on our wings, 1
have n't had so much, 1
here 's dust in your, 1
we just have to flush, 1
thought you might like this, 1
was too hot for anyone, 1
like a willow in the, 1
it a ghost it wo, 1
an accident i 'm sure, 1
is nice to have everything, 1
w-well i hope your d-d-dad, 1
that creature cared for us, 1
he 's a horrible creature, 1
sometimes it 's hard not, 1
you want with us now, 1
back a treasure of equal, 1
mean to disobey you hydia, 1
but now i 'm making, 1
ca n't make it go, 1
it takes to be a, 1
i wasted a perfectly good, 1
that 's owed the apology, 1
's shadow including my own, 1
times in the last year, 1
promised to make me a, 1
hope it is n't too, 1
lilac would just get her, 1
it was just an accident, 1
crank in 'em just like, 1
now that 's what i, 1
whoever is " it ", 1
just a couple more clouds, 1
and it was for such, 1
to look at when we, 1
we can find his elevated, 1
house is not far from, 1
coming back here knight shade, 1
she should n't make fun, 1
anyway it 's just as, 1
do you know how to, 1
