sequence, count
single lonely tear rolled down, 1
's trapped inside in trouble, 1
as i 'm alive squirk, 1
might not have any trees, 1
your looks are n't important, 1
wind whistler now we finish, 1
bad we ca n't take, 1
learn how to control them, 1
when the sun sets flutter, 1
the cupcakes 'cause if you, 1
do n't believe in curses, 1
's a beautiful day the, 1
tree uh must have been, 1
oh yeah yeah sure sure, 1
it is it 's bad, 1
but of course it is, 1
know that we 're your, 1
my wings are heavy from, 1
much to look at when, 1
i 'll give you a, 1
so there are probably all, 1
'll try it grandfather but, 1
all aware that there are, 1
but midnight is not far, 1
dwellers the forest might not, 1
it 's the witches from, 1
valley is no more megan, 1
've come after us. to, 1
romantic idiots for so long, 1
looked like 40 miles of, 1
here ponies possess magical properties, 1
of midnight as you should, 1
about to receive some company, 1
it back to royal paradise, 1
you to knock the frazzits, 1
'm all out of surprises, 1
oh well that explains it, 1
who 're you talking to, 1
for herself and only gives, 1
jump out yelling " surprise, 1
they might cancel out the, 1
're just following grogar 's, 1
we 'll never save it, 1
to paradise estate and check, 1
pony needs horseshoe more than, 1
give it a good swat, 1
should bring her a present, 1
terrific jumper and you can, 1
back to their camp with, 1
as you should have known, 1
i hope your d-d-dad knows, 1
could be happening to the, 1
for the real one maybe, 1
more fans came to see, 1
've been there it 's, 1
want anyone to think that, 1
get the prince back in, 1
enough to stand on my, 1
of these coins can have, 1
do n't go near it, 1
to paradise estate and i, 1
give it all you 've, 1
to do with my time, 1
somewhere in the purple mountains, 1
you to make a landslide, 1
'll have to find another, 1
get me out of here, 1
you are king you may, 1
break it molly you 're, 1
everything is back to normal, 1
that 's the only way, 1
take newborn twins for walk, 1
was looking for a replacement, 1
of the keepers of the, 1
fudgy mcswain 's a thief, 1
you do n't go messing, 1
campgrounds before we move on, 1
to escape and make their, 1
and i think it 's, 1
kind as to lower the, 1
've got to help us, 1
do n't have to worry, 1
" what good would that, 1
keep an eye on them, 1
fudgy looks like i owe, 1
come on they could n't, 1
is all right now locket, 1
we run away and we, 1
will be flooded and you, 1
said he wanted in return, 1
take them to the horseshoe, 1
but how will we get, 1
anybody got a clue as, 1
there are plenty of other, 1
's an awful witch who, 1
it 's hard not to, 1
interested in a little plan, 1
all repeat ] [ all, 1
have to do is follow, 1
think that old troll would, 1
but that took forever to, 1
's got to get megan, 1
i 'd bring you right, 1
can you ask a question, 1
face with the old witch, 1
a queen needs to have, 1
this is the throne room, 1
oh yes oh yes oh, 1
and this time the rest, 1
a dungeon will look nice, 1
i was saving it for, 1
can have some of mine, 1
there 's more important things, 1
got all day come on, 1
garth can awaken ariel with, 1
that she 's put down, 1
no truly wind whistler 's, 1
this for a special occasion, 1
hiding it under my hat, 1
he wind up back in, 1
she 's thinking it over, 1
there 's paul bunyan and, 1
girl with the locket that, 1
'll know her when you, 1
are you saying no to, 1
tickle him and he 'll, 1
ever fly like firefly and, 1
on his way to his, 1
where did this come from, 1
thought i 'd never see, 1
i was ready to give, 1
of replacing my magical cloak, 1
think baby half note might, 1
nothing could ever change that, 1
you do n't think it, 1
get those keys from him, 1
to join the scavenger hunt, 1
better get this back to, 1
does n't mean you 're, 1
as high as a tree, 1
i know we sent it, 1
face the other ponies if, 1
to get down there and, 1
do n't want to get, 1
it 's megan and applejack, 1
we 're so glad we, 1
their shadows and we want, 1
you think you ought to, 1
just like the good old, 1
free there 's still a, 1
no no tumbleweed you are, 1
that 's why it has, 1
floating in a pond of, 1
horseshoe stolen a long time, 1
hypothesis that a strange enclave, 1
i was s'posed ta fixed, 1
he 's the only one, 1
a game of make-believe sound, 1
away my little flutter ponies, 1
yeah yeah this is it, 1
getting warm in here or, 1
estate did n't really collapse, 1
must be even more magnificent, 1
now stop being so hard, 1
that 'll teach him a, 1
very hard to give it, 1
boys are modeling for you, 1
's from the purple mountains, 1
found in that walled-up room, 1
can you find your way, 1
clumsy that you seem to, 1
what we 've been looking, 1
of hay in a needle, 1
widen the crack something we, 1
not be dreary if you, 1
you love him and you, 1
to fall in love yet, 1
sorry baby lickety-split we 're, 1
'd never have any hope, 1
hey what happened -where 'd, 1
you think they 'll hurt, 1
ooh- get it ooh- ooh, 1
and finding a way to, 1
from somewhere in the purple, 1
maybe if we all do, 1
're gone back into the, 1
just that i must do, 1
more magnificent than i thought, 1
sounds like it 's working, 1
owe you a great debt, 1
na show me how to, 1
for that we 'll have, 1
walk as adults and they, 1
if we keep an eye, 1
'specially that there buttons huh, 1
wand i can snuff you, 1
well you 'll know her, 1
the duchess is your cook, 1
get noticed 'round here are, 1
and loud and the fourth, 1
and as he chased he, 1
up for a flight and, 1
let them escape you buzzoff, 1
why do n't you let, 1
a covert surveillance and report, 1
children could be happening to, 1
what you do with her, 1
let 's not jump to, 1
but who 's ever gon, 1
and what you would do, 1
creatures of flesh are alive, 1
wind whistler means shady is, 1
who takes the youth for, 1
father 's magnifier and get, 1
known of your need for, 1
bigger cupcake but you now, 1
nag does n't know what, 1
a direct descendent of that, 1
job to do morning glory, 1
in a crack than eat, 1
lesser crested snicklewhacker in the, 1
ta know if she 's, 1
instead of arguing now let, 1
to catrina and whatever you, 1
to you where we 're, 1
yes hercules so do we, 1
for your bravery we knight, 1
buttons would you play a, 1
hers or zat of your, 1
're supposed to be mine, 1
we 'll get it back, 1
whistler uh we 're sorry, 1
most beautiful place in all, 1
predict north star 's return, 1
n't suppose everyone can enjoy, 1
now according to this the, 1
yeah we could do that, 1
just caught north star and, 1
you could stay with them, 1
think they have no idea, 1
those flutter ponies if it, 1
's face looked like 40, 1
help my friends they need, 1
the flories have n't done, 1
tiffany i 'll go with, 1
've no intention of giving, 1
well to be a monster, 1
nope i want those little, 1
quacker why are you going, 1
be your own special little, 1
you may decide what is, 1
we 're here mr. moochick, 1
it does n't take much, 1
well that cloak was probably, 1
both good and true your, 1
powerful flashstone squirk tried to, 1
four a hundred and seventy, 1
got to get them outta, 1
four-legged suckers the long claws, 1
yourself with charms of luck, 1
out of the water long, 1
see you tomorrow knight shade, 1
sunstone back here soon we, 1
maybe we 've gone as, 1
raptorians come with nets and, 1
replace all these surprised balloons, 1
the horseshoe far away from, 1
it 's not my place, 1
heart throb do n't you, 1
of argyte four horseshoes were, 1
tried to protect you but, 1
do n't you wan na, 1
i 'll just see what, 1
maybe he 's got some, 1
knight who wo n't give, 1
okay let 's go back, 1
jump far like bow tie, 1
've come here to ask, 1
anyway i think i just, 1
seen 'nuff ice cream for, 1
're up to your eyeballs, 1
our duty to protect the, 1
color orange in the sunset, 1
the gate is not far, 1
the giant that goes boom, 1
i 've always wanted an, 1
i mean a huge one, 1
why bumble and her bees, 1
it i really do--then again, 1
grogar 's power will be, 1
that 's going too far, 1
him before and he betrayed, 1
go under the ocean for, 1
hi we 're looking for, 1
but how do we do, 1
the good guys in jail, 1
say you 're gon na, 1
'til i change into my, 1
course it is n't dream, 1
valentine 's friend gallop away, 1
your friend on my back, 1
reach this floating castle faster, 1
sound like a good idea, 1
" sound clear and loud, 1
i 'm stuck on my, 1
we 've got ta be, 1
not cut out for this, 1
positively ruined by the heat, 1
ponies live in dream valley, 1
try again if you can, 1
get newborn twins some place, 1
and we need your help, 1
can i do that is, 1
paint touches will be transformed, 1
all he needs is a, 1
i just want to ground, 1
is all in her cloak, 1
be mad when he hears, 1
whap it with your nose, 1
what you did to our, 1
we ask it to go, 1
'll find out what 's, 1
's time for me to, 1
replacement cloak for your loveliness, 1
it 's a matter of, 1
had n't been so overly, 1
do aerial photography of ponyland, 1
asked if we could help, 1
oh it 's all sting, 1
in a pond of her, 1
need your help to get, 1
ca n't i do it, 1
's too far for me, 1
with all the food they, 1
if we all do it, 1
able to see your own, 1
all my life my heart, 1
've become a disaster area, 1
light is the most powerful, 1
we 've got something better, 1
just wanted to tell you, 1
pony surprise and will give, 1
strong because of the wish, 1
and after we rebuild this, 1
know just how you feel, 1
up for the costume ball, 1
molly we 've got ta, 1
yeah i 'm sorry i, 1
i 'll be down here, 1
yeah i can move my, 1
shady we need you to, 1
her friend gallop away into, 1
down there than you think, 1
count to twenty and then, 1
've been waiting for this, 1
go after him right now, 1
would-be knight to do a, 1
we 've gotten ourselves into, 1
leave before the whole town, 1
feel the glassy wrath of, 1
balance of nature is preserved, 1
might be interested in a, 1
are you willing to risk, 1
been terribly worried ever since, 1
it 's a good idea, 1
a perfect day--do n't be, 1
on your way now to, 1
day for a picnic lickety-split, 1
queen a princess pony has, 1
wind whistler is acting so, 1
good and true your small, 1
up the ground and chase, 1
and you 'll be sorry, 1
most delightful replacement cloak for, 1
stuck with me my boy, 1
's so weak it 's, 1
fizzy you 've got to, 1
dell dwellers the forest might, 1
a taste of real magic, 1
do n't think you will, 1
sing backup for knight shade, 1
no it was well a, 1
we wo n't take long, 1
ca n't reach the sunstone, 1
lot to be said for, 1
stumble round in the dark, 1
's gone on a trip, 1
the flutter ponies have escaped, 1
well that was n't exactly, 1
's too mean to listen, 1
flories they lied to us, 1
forts and have a snowball, 1
in the mirror this morning, 1
the master said you 'd, 1
helped us furbobs so we, 1
too much of a good, 1
there 're still two coins, 1
you just rest easy for, 1
now you 'll learn some, 1
in a matter of seconds, 1
these wretched ponies a piece, 1
bell might be the source, 1
oh i just ca n't, 1
i 'm going with ya, 1
come after us. to hunt, 1
that can be anything you, 1
we do n't know the, 1
estate would 've become a, 1
where the baby ponies could, 1
into a lot of trouble, 1
may i take your order, 1
would have kept going when, 1
i guess hide and seek, 1
castle 's starting to fall, 1
i could have helped them, 1
make it bubble it would, 1
guess we should let everyone, 1
the only one that has, 1
just like that giant bear, 1
oh do n't worry bumble, 1
of paradise estate collapsed but, 1
a wizard and promised to, 1
good thing for me to, 1
dust would n't have much, 1
hold on i 'm going, 1
'll get the next item, 1
my cold heart which--do n't, 1
do anything with the stone, 1
know what any of these, 1
can circle through the woods, 1
and took them with them, 1
as babies they walk as, 1
gee what if the big, 1
not accomplishing anything waiting for, 1
well why ca n't you, 1
thought you were a bushwoolie, 1
flowers could be capable of, 1
replacement for sir huguenot and, 1
explanation for this seemingly mean, 1
n't have any choice did, 1
off and leave poor gusty, 1
get out of this dreadful, 1
they ca n't do this, 1
picks it up to eat, 1
as though everything is going, 1
could go fly a kite, 1
material that the boys are, 1
not all little ponies can, 1
the earth pony jumping finals, 1
know this was a party, 1
'll also need to know, 1
day and make cookies and, 1
us but paradise estate is, 1
and only for special things, 1
and i will try it, 1
oh no no no never, 1
we 'll hoist our jib, 1
really awesome techno-stuff in here, 1
's a long terrible story, 1
see why we need the, 1
get them master honest i, 1
'll take you to meet, 1
will tell me how to, 1
fly over to it wind, 1
guess you were right honeysuckle, 1
of ya all not playin', 1
i want to find ariel, 1
n't know if i did, 1
if only we could fly, 1
saw a bird or a, 1
being so hard on yourself, 1
's certainly is nice to, 1
favorite old toy over the, 1
be held here until they, 1
brothers like they walking in, 1
was underwater and ruled by, 1
wo n't hurt will it, 1
'll just get it back, 1
's going to feed you, 1
everybody let 's make a, 1
not what i was going, 1
famous and you could have, 1
could change and be good, 1
come from one of your, 1
if your fire breathing powers, 1
it 's gaining on us, 1
i have to face them, 1
even if they wanted to, 1
a plan for obtaining it, 1
of you is thinkin' worser, 1
ponies ' big deal celebration, 1
see us all sooner than, 1
you wish to continue being, 1
gotten careless and dropped it, 1
we can bring the wands, 1
we can retrieve the gem, 1
is find this eminence guy, 1
have kept going when things, 1
the list is a sea, 1
have n't you seen all, 1
drink this my little ahhgy, 1
to those four-legged suckers the, 1
has a favor to ask, 1
i will not fail you, 1
you ca n't do this, 1
magnifier and get him to, 1
must be around here somewhere, 1
it have to do with, 1
used his magic the bell, 1
what if they have the, 1
can do that others ca, 1
before i pull you under, 1
wo n't need an air, 1
's not waste any more, 1
seem to get to the, 1
which i knocked us into, 1
we still got ta find, 1
read my mind ribbon but, 1
's no way out of, 1
door and they 'll all, 1
it 's awfully high up, 1
protoplasmic organisms are ruining the, 1
this tunnel should lead right, 1
and the babies ' too, 1
that he give everyone their, 1
'm so glad you asked, 1
oh what did i do, 1
settle down and go back, 1
whole life has n't been, 1
two sixty four a hundred, 1
n't you undo the spell, 1
you 'd better wake up, 1
just by snapping his fingers, 1
is on ze guard 's, 1
who 's going to make, 1
whole place back to normal, 1
shoo-bee-doo shoop-shoop-bee-doo shoo-bee-doo shoop-shoop-bee-doo what, 1
darlings we 've been trying, 1
've spliced the tape together, 1
paradise estate when the troggles, 1
there 's a flower inside, 1
that leg of yours will, 1
yeah what 's tag what, 1
to help zeb supply him, 1
will fade forever it 's, 1
thing tonight being upper class, 1
's up to us to, 1
else would you expect from, 1
some kind of huge bird, 1
any of the secret tunnels, 1
mistreating such lovely flowers as, 1
then you must all work, 1
you 're crushin' my fibers, 1
bravest just because you did, 1
these gullies like the back, 1
course but what should i, 1
my true love is named, 1
and i 'll find it, 1
just stay with us understand, 1
realm of darkness at midnight, 1
what 's going to happen, 1
a little too much excitement, 1
na get away with it, 1
would risk anything for a, 1
that 's a good one, 1
's not the way you, 1
na have to bed down, 1
take my act on the, 1
but hydia do n't you, 1
're about to find out, 1
food and keep it coming, 1
and grab them that 's, 1
well i did drop my, 1
run my little friends but, 1
ball would be like to, 1
you concentrate on flying wind, 1
i did learn one thing, 1
this sticky little flutter pony, 1
this so only the man, 1
should lead right to the, 1
powerful enough to defeat him, 1
fudgy mcswain listen to us, 1
it 's time to ring, 1
another 's thoughts " sound, 1
egg blue your royal blue, 1
did what she told me, 1
've been following the ponies, 1
feels like we 've been, 1
left my backpack at paradise, 1
one as she made her, 1
'm sorry woebegone but you, 1
and you say lavan stole, 1
the right and you 're, 1
courage he took the flashstone, 1
then i 'll get the, 1
all the ice-cream cones i, 1
can save the rest of, 1
to use one of the, 1
fields and flowers and spreads, 1
the signal shell that i, 1
and i 'll remember all, 1
king you may decide what, 1
we need it for mimic, 1
light is the only thing, 1
going to be in shape, 1
[ all repeat ] [, 1
'll be on your way, 1
to go where he ca, 1
this is it this is, 1
not something to be rushed, 1
be there as soon as, 1
over the years the water, 1
it 's always warm and, 1
we ca n't let you, 1
in the first place that, 1
's have a go at, 1
wish we could go with, 1
n't know what any of, 1
the little ponies will save, 1
been put right in ponyland, 1
now she kinda grows on, 1
is it getting warm in, 1
i could never have taken, 1
is and pick us off, 1
the water would dry up, 1
but well it could be, 1
it does n't seem quite, 1
make your air bubbles fizzy, 1
we have a big meal, 1
to paradise estate and organize, 1
ice-cream cone should have lasted, 1
it 's a dead end, 1
i ever glad to see, 1
if you really wan na, 1
thank you baby heart throb, 1
ca n't help you if, 1
not now i 've got, 1
have they were here just, 1
na have to go back, 1
gluda and gock come back, 1
trick without backfiring on us, 1
get this to squirk right, 1
make bumbleland drip with rich, 1
lickety-split standing on one as, 1
that 's what grandfather said, 1
i think you 're right, 1
i can jump farther than, 1
we 'll lead you to, 1
and i are going in, 1
the air 's thin up, 1
it in the ice cream, 1
oh boy are we glad, 1
me build a little ol', 1
sure hope they 're okay, 1
stop them because they 'll, 1
but there 's a tail, 1
get the baby ponies ', 1
back and visit the new, 1
i mean it used to, 1
it 's all sting 's, 1
screes only bet on sure, 1
maybe you 're trying too, 1
i do n't know exactly, 1
until we know what 's, 1
does it have to do, 1
and what i say is, 1
of your little friends back, 1
magic has gone funny too, 1
think it 's his elevated, 1
with them to the black, 1
it did n't even rain, 1
mean since the duchess ascended, 1
you give it back to, 1
a better chance of finding, 1
over there and grab it, 1
shoop-shoop-bee-doo shoo-bee-doo shoop-shoop-bee-doo oh so, 1
i do not have a, 1
my chariot does not roll, 1
wo n't have a home, 1
into the deepest part of, 1
think we should count on, 1
the green hills around here, 1
trust megan and the ponies, 1
this way exactly this way, 1
've got to find out, 1
spike s a real friend, 1
in the middle of the, 1
steed panza and i was, 1
i know enough to be, 1
you seek the rainbow of, 1
when the troggles took over, 1
promised your mothers i 'd, 1
creature cared for us like, 1
'll see if i can, 1
course we scree only bet, 1
there 's the fine ship, 1
you like it when you, 1
damage but you you went, 1
to lure grogar outside the, 1
and so we need your, 1
you need is your imagination, 1
the morning two at mid, 1
ca n't you think of, 1
a wonderful thought to be, 1
to try and save the, 1
these romantic idiots for so, 1
now baby lickety-split it wo, 1
it 's loudest at this, 1
soon we 'll have the, 1
all it was probably my, 1
would turn bumbleland into a, 1
we 'll ever get the, 1
n't wan na play anymore, 1
'll steal my shadow which, 1
megan a friend of the, 1
some rope in that sack, 1
's been hiding from us, 1
the sunstone will fade forever, 1
just love a tidy place, 1
castle reach the chamber wherein, 1
anything bad happen to you, 1
down the mixville ice cream, 1
him and you proved it, 1
did you wish for megan, 1
oh oh we simply must, 1
your cerulean blue your robin, 1
a kingdom to call home, 1
you see baby ribbon you, 1
clean through the wash with, 1
n't you seen all the, 1
creature and a fire creature, 1
'll bet everybody thinks i, 1
ponyland in the dungeons by, 1
with winter coming soon and, 1
that took forever to build, 1
up there on that high, 1
time to put things right, 1
point in talking to the, 1
dell and the entire forest, 1
will find another horseshoe stolen, 1
did it would n't be, 1
not yet begun to fight, 1
still real big and strong, 1
it--it looks like we 've, 1
'll we ever find our, 1
the most treasure so far--everything, 1
keeping things neat but he, 1
then you can stop that, 1
do you really think so, 1
're helping a would-be knight, 1
aye and it 'll be, 1
that the best ya all, 1
hero aileen 's wed attracts, 1
have to do is tickle, 1
there 's no water there, 1
would you please help me, 1
's right 18 19 20, 1
cold has to come from, 1
the castle before you woke, 1
is it much farther to, 1
you are not all merry, 1
what i wan na know, 1
may accompany us so that, 1
here soon we can kiss, 1
newborn twins some place safe, 1
you can give me that, 1
satchel should be in one, 1
and i must say it, 1
something before they rip up, 1
to feel the glassy wrath, 1
same place as that woebegone, 1
better go fetch megan if, 1
one half into the deepest, 1
bag of flubber porcina ever, 1
you think you 're hitting, 1
's keep out of sight, 1
without it he 's turning, 1
n't worry it 's safe, 1
be the end of it, 1
find no trace of the, 1
turn the other wing morning, 1
she 'll help mimic get, 1
she 's trapped inside in, 1
we do n't want any, 1
as a singer there but, 1
the little ponies telling us, 1
then let the ponies in, 1
would n't it be more, 1
so did you have fun, 1
but we have to try, 1
to exile the ponies he, 1
in tarnation are you doin', 1
uh yes greetings your eminence, 1
what 's causing all these, 1
it in you all the, 1
party and follow their trail, 1
you 've got to admit, 1
and do aerial photography of, 1
he 's long gone now, 1
've had enough exploring for, 1
we are sure to find, 1
three will do for now, 1
live here including my kin, 1
we never had one before, 1
m-my wh-whole family is packing, 1
i 've done to her, 1
to dry up the undine, 1
have a go at it, 1
if you sprinkle it on, 1
they wo n't let us, 1
most would be if you, 1
a bubble but what good, 1
huh can we huh please, 1
is simply death to my, 1
got from the sea ponies, 1
just wan na make certain, 1
but they give him power, 1
that is we--well we spent, 1
if we go back to, 1
promise we 'll bring you, 1
bubbles fizzy so we can, 1
i was just mopped an, 1
like this are always happening, 1
the first to feel the, 1
fight because the magic horseshoe, 1
but squirk he did n't, 1
looks like we 've got, 1
will become dark dank and, 1
dungeon will look nice compared, 1
suppose we 'll ever meet, 1
well oh you told me, 1
well uh uh that is, 1
she did n't wink back, 1
did n't mean it megan, 1
ponies look a little bored, 1
's all up to you, 1
find water soon wind whistler, 1
had it in you all, 1
n't splash me you ca, 1
spell which means you have, 1
if you free us we, 1
i hear the sound of, 1
i sure hope the moochick, 1
bad luck that might be, 1
you and your friends will, 1
agean 's stables filthy dirt, 1
it is n't dream valley, 1
this huge cloud of energy, 1
have n't got all day, 1
you think we can make, 1
shady you had no idea, 1
one person who can help, 1
lie down my beautiful porkiness, 1
now they 're your problem, 1
you guys look it 's, 1
quit helping you steal shadows, 1
is just whap it with, 1
it 's the way out, 1
visit the new kingdom of, 1
you some more nectar your, 1
small to pull my chariot, 1
mama zose are ze little, 1
but i 'm so cold, 1
grateful we are you can, 1
there now i need your, 1
before the castle can pull, 1
'll be back anytime soon, 1
stop squirk from turning ponyland, 1
's no time to save, 1
i wish it never rained, 1
and so the giant chased, 1
from if you start any, 1
then come home with us, 1
our newborn twins want their, 1
teach ya who to root, 1
you there is no ghost, 1
the piece of paper with, 1
a dragon you really are, 1
majesty my father wishes to, 1
the rockdog turned bushwoolies-turned bushwoolies-, 1
true love but where is, 1
have what it takes to, 1
it 's pretty high up, 1
unfortunately you 're not nearly, 1
walled-up room is important somehow, 1
megan 's come to show, 1
best way to find out, 1
inside the walls of lavan, 1
they did he used the, 1
uh maybe you 'd all, 1
are sure to find something, 1
he turns into a permanent, 1
able to admire my rare, 1
of accomplishment to make you, 1
'd better help yourself first, 1
you let them escape you, 1
from the purple mountain oh, 1
to play in a village, 1
let 's put one over, 1
this work without any glory, 1
some of me up here, 1
there are some bad things, 1
bad about that poor bushwoolie, 1
i will go with you, 1
's that 's not it, 1
but it 's so small, 1
you will take their place, 1
find one such as yourself, 1
'm a nurse i have, 1
at one of the towers, 1
tell you to leave us, 1
oh poor wind whistler she, 1
well of course he does, 1
mean you lost them at, 1
thinks i 'm useless and, 1
grayvale and my mother to, 1
squirk i 'll never see, 1
it is obvious that the, 1
actually live below the forest, 1
to niblick only he can, 1
i just hope you 'll, 1
's do what we can, 1
place in ponyland where you, 1
